Differences found in /0_0
--- results.05_03_2009/freebsd7_20071205/1//0_0.server.processed	2009-05-04 18:19:05.000000000 -0500
+++ results.05_03_2009/freebsd7_20071203/1//0_0.server.processed	2009-05-04 18:20:36.000000000 -0500
@@ -1,4 +1,4 @@
-0.0 IP server > client: S 0:0(0) ack 0 win 65535 <mss 1460,nop,wscale 4,sackOK,timestamp 0 0>
+0.0 IP server > client: S 0:0(0) ack 0 win 65535 <mss 1460,nop,wscale 4,nop,nop,timestamp 0 0>
 0.0 IP server > client: . ack 1 win 32037 <nop,nop,timestamp 0 0>
 0.0 IP server > client: . 1:1449(1448) ack 1 win 32037 <nop,nop,timestamp 0 0>
 0.0 IP server > client: . 1449:2897(1448) ack 1 win 32037 <nop,nop,timestamp 0 0>
Differences found in /0_1
--- results.05_03_2009/freebsd7_20071205/1//0_1.server.processed	2009-05-04 18:19:05.000000000 -0500
+++ results.05_03_2009/freebsd7_20071203/1//0_1.server.processed	2009-05-04 18:20:36.000000000 -0500
@@ -1,5 +1,5 @@
-0.0 IP server > client: S 0:0(0) ack 0 win 65535 <mss 1460,nop,wscale 4,sackOK,timestamp 0 0> dropped
-0.0 IP server > client: S 0:0(0) ack 0 win 65535 <mss 1460,nop,wscale 4,sackOK,timestamp 0 0>
+0.0 IP server > client: S 0:0(0) ack 0 win 65535 <mss 1460,nop,wscale 4,nop,nop,timestamp 0 0> dropped
+0.0 IP server > client: S 0:0(0) ack 0 win 65535 <mss 1460,nop,wscale 4,nop,nop,timestamp 0 0>
 0.0 IP server > client: . ack 1 win 32037 <nop,nop,timestamp 0 0>
 0.0 IP server > client: . 1:1449(1448) ack 1 win 32037 <nop,nop,timestamp 0 0>
 0.0 IP server > client: . 1449:2897(1448) ack 1 win 32037 <nop,nop,timestamp 0 0>
Differences found in /0_2
--- results.05_03_2009/freebsd7_20071205/1//0_2.server.processed	2009-05-04 18:19:05.000000000 -0500
+++ results.05_03_2009/freebsd7_20071203/1//0_2.server.processed	2009-05-04 18:20:36.000000000 -0500
@@ -1,4 +1,4 @@
-0.0 IP server > client: S 0:0(0) ack 0 win 65535 <mss 1460,nop,wscale 4,sackOK,timestamp 0 0>
+0.0 IP server > client: S 0:0(0) ack 0 win 65535 <mss 1460,nop,wscale 4,nop,nop,timestamp 0 0>
 0.0 IP server > client: . ack 1 win 32037 <nop,nop,timestamp 0 0> dropped
 0.0 IP server > client: . 1:1449(1448) ack 1 win 32037 <nop,nop,timestamp 0 0>
 0.0 IP server > client: . 1449:2897(1448) ack 1 win 32037 <nop,nop,timestamp 0 0>
Differences found in /0_24,25,26,27,28,29,30,31,32,33,34,35,36,37,38,39,40,41,42,43,44,45,46,47,48,49,50,51,52,53,54,55,56,57,58,59
--- results.05_03_2009/freebsd7_20071205/1//0_24,25,26,27,28,29,30,31,32,33,34,35,36,37,38,39,40,41,42,43,44,45,46,47,48,49,50,51,52,53,54,55,56,57,58,59.client.processed	2009-05-04 18:19:05.000000000 -0500
+++ results.05_03_2009/freebsd7_20071203/1//0_24,25,26,27,28,29,30,31,32,33,34,35,36,37,38,39,40,41,42,43,44,45,46,47,48,49,50,51,52,53,54,55,56,57,58,59.client.processed	2009-05-04 18:20:36.000000000 -0500
@@ -13,14 +13,12 @@
 0.09 IP client > server: . ack 30409 win 30136 <nop,nop,timestamp 0 0>
 89.84 IP client > server: F 1:1(0) ack 30409 win 32037 <nop,nop,timestamp 0 0>
 0.29 IP client > server: F 1:1(0) ack 30409 win 32037 <nop,nop,timestamp 0 0>
-0.39 IP client > server: F 1:1(0) ack 30409 win 32037 <nop,nop,timestamp 0 0>
-0.59 IP client > server: F 1:1(0) ack 30409 win 32037 <nop,nop,timestamp 0 0>
-0.99 IP client > server: F 1:1(0) ack 30409 win 32037 <nop,nop,timestamp 0 0>
-1.78 IP client > server: F 1:1(0) ack 30409 win 32037 <nop,nop,timestamp 0 0>
-2.56 IP client > server: F 1:1(0) ack 30409 win 32037 <nop,nop,timestamp 0 0>
-4.93 IP client > server: F 1:1(0) ack 30409 win 32037 <nop,nop,timestamp 0 0>
-9.67 IP client > server: F 1:1(0) ack 30409 win 32037 <nop,nop,timestamp 0 0>
-19.14 IP client > server: F 1:1(0) ack 30409 win 32037 <nop,nop,timestamp 0 0>
-38.08 IP client > server: F 1:1(0) ack 30409 win 32037 <nop,nop,timestamp 0 0>
-38.08 IP client > server: F 1:1(0) ack 30409 win 32037 <nop,nop,timestamp 0 0>
-0.0 IP client > server: R 1122582391:1122582391(0) win 0
+0.38 IP client > server: F 1:1(0) ack 30409 win 32037 <nop,nop,timestamp 0 0>
+0.57 IP client > server: F 1:1(0) ack 30409 win 32037 <nop,nop,timestamp 0 0>
+0.94 IP client > server: F 1:1(0) ack 30409 win 32037 <nop,nop,timestamp 0 0>
+1.68 IP client > server: F 1:1(0) ack 30409 win 32037 <nop,nop,timestamp 0 0>
+2.41 IP client > server: F 1:1(0) ack 30409 win 32037 <nop,nop,timestamp 0 0>
+4.61 IP client > server: F 1:1(0) ack 30409 win 32037 <nop,nop,timestamp 0 0>
+9.02 IP client > server: F 1:1(0) ack 30409 win 32037 <nop,nop,timestamp 0 0>
+17.86 IP client > server: F 1:1(0) ack 30409 win 32037 <nop,nop,timestamp 0 0>
+0.0 IP client > server: R 1150287833:1150287833(0) win 0
Differences found in /0_24,25,26,27,28,29,30,31,32,33,34,35,36,37,38,39,40,41,42,43,44,45,46,47,48,49,50,51,52,53,54,55,56,57,58,59
--- results.05_03_2009/freebsd7_20071205/1//0_24,25,26,27,28,29,30,31,32,33,34,35,36,37,38,39,40,41,42,43,44,45,46,47,48,49,50,51,52,53,54,55,56,57,58,59.server.processed	2009-05-04 18:19:05.000000000 -0500
+++ results.05_03_2009/freebsd7_20071203/1//0_24,25,26,27,28,29,30,31,32,33,34,35,36,37,38,39,40,41,42,43,44,45,46,47,48,49,50,51,52,53,54,55,56,57,58,59.server.processed	2009-05-04 18:20:36.000000000 -0500
@@ -1,4 +1,4 @@
-0.0 IP server > client: S 0:0(0) ack 0 win 65535 <mss 1460,nop,wscale 4,sackOK,timestamp 0 0>
+0.0 IP server > client: S 0:0(0) ack 0 win 65535 <mss 1460,nop,wscale 4,nop,nop,timestamp 0 0>
 0.0 IP server > client: . ack 1 win 32037 <nop,nop,timestamp 0 0>
 0.0 IP server > client: . 1:1449(1448) ack 1 win 32037 <nop,nop,timestamp 0 0>
 0.0 IP server > client: . 1449:2897(1448) ack 1 win 32037 <nop,nop,timestamp 0 0>
@@ -38,23 +38,23 @@
 0.42 IP server > client: . 30409:31857(1448) ack 1 win 32037 <nop,nop,timestamp 0 0> dropped
 0.65 IP server > client: . 30409:31857(1448) ack 1 win 32037 <nop,nop,timestamp 0 0> dropped
 1.11 IP server > client: . 30409:31857(1448) ack 1 win 32037 <nop,nop,timestamp 0 0> dropped
-2.03 IP server > client: . 30409:31857(1448) ack 1 win 32037 <nop,nop,timestamp 0 0> dropped
-3.55 IP server > client: . 30409:31857(1448) ack 1 win 32037 <nop,nop,timestamp 0 0> dropped
-6.91 IP server > client: . 30409:31857(1448) ack 1 win 32037 <nop,nop,timestamp 0 0> dropped
-13.63 IP server > client: . 30409:31857(1448) ack 1 win 32037 <nop,nop,timestamp 0 0> dropped
-27.07 IP server > client: . 30409:31857(1448) ack 1 win 32037 <nop,nop,timestamp 0 0> dropped
+2.02 IP server > client: . 30409:31857(1448) ack 1 win 32037 <nop,nop,timestamp 0 0> dropped
+3.52 IP server > client: . 30409:31857(1448) ack 1 win 32037 <nop,nop,timestamp 0 0> dropped
+6.85 IP server > client: . 30409:31857(1448) ack 1 win 32037 <nop,nop,timestamp 0 0> dropped
+13.5 IP server > client: . 30409:31857(1448) ack 1 win 32037 <nop,nop,timestamp 0 0> dropped
+26.81 IP server > client: . 30409:31857(1448) ack 1 win 32037 <nop,nop,timestamp 0 0> dropped
 0.0 IP server > client: . ack 2 win 32037 <nop,nop,timestamp 0 0> dropped
 0.0 IP server > client: . 31857:33305(1448) ack 2 win 32037 <nop,nop,timestamp 0 0> dropped
 0.0 IP server > client: . 33305:34753(1448) ack 2 win 32037 <nop,nop,timestamp 0 0> dropped
 0.0 IP server > client: . 34753:36201(1448) ack 2 win 32037 <nop,nop,timestamp 0 0> dropped
 0.0 IP server > client: . ack 2 win 32037 <nop,nop,timestamp 0 0> dropped
+0.0 IP server > client: . 36201:37649(1448) ack 2 win 32037 <nop,nop,timestamp 0 0> dropped
+0.0 IP server > client: . 37649:39097(1448) ack 2 win 32037 <nop,nop,timestamp 0 0> dropped
+0.0 IP server > client: . 39097:40545(1448) ack 2 win 32037 <nop,nop,timestamp 0 0> dropped
 0.0 IP server > client: . ack 2 win 32037 <nop,nop,timestamp 0 0> dropped
-0.0 IP server > client: . ack 2 win 32037 <nop,nop,timestamp 0 0> dropped
-0.0 IP server > client: . ack 2 win 32037 <nop,nop,timestamp 0 0> dropped
-0.0 IP server > client: . ack 2 win 32037 <nop,nop,timestamp 0 0> dropped
-0.0 IP server > client: . ack 2 win 32037 <nop,nop,timestamp 0 0> dropped
-0.0 IP server > client: . ack 2 win 32037 <nop,nop,timestamp 0 0> dropped
-14.86 IP server > client: . 30409:31857(1448) ack 2 win 32037 <nop,nop,timestamp 0 0> dropped
+0.0 IP server > client: . 40545:41993(1448) ack 2 win 32037 <nop,nop,timestamp 0 0> dropped
+7.91 IP server > client: . 30409:31857(1448) ack 2 win 32037 <nop,nop,timestamp 0 0> dropped
 0.0 IP server > client: . 31857:33305(1448) ack 2 win 32037 <nop,nop,timestamp 0 0> dropped
-30.73 IP server > client: . 30409:31857(1448) ack 2 win 32037 <nop,nop,timestamp 0 0> dropped
-0.0 IP server > client: . 31857:33305(1448) ack 2 win 32037 <nop,nop,timestamp 0 0>
+0.0 IP server > client: . 33305:34753(1448) ack 2 win 32037 <nop,nop,timestamp 0 0> dropped
+0.0 IP server > client: . 34753:36201(1448) ack 2 win 32037 <nop,nop,timestamp 0 0> dropped
+34.46 IP server > client: . 30409:31857(1448) ack 2 win 32037 <nop,nop,timestamp 0 0>
Differences found in /0_24,25,26,27,28,29,30,31,32,33,34,35,36,37,38,39,40,41,42,43,44,45,46,47,48,49,50,51,52,53,54,55,56,57,58,59_nodelay
--- results.05_03_2009/freebsd7_20071205/1//0_24,25,26,27,28,29,30,31,32,33,34,35,36,37,38,39,40,41,42,43,44,45,46,47,48,49,50,51,52,53,54,55,56,57,58,59_nodelay.client.processed	2009-05-04 18:19:05.000000000 -0500
+++ results.05_03_2009/freebsd7_20071203/1//0_24,25,26,27,28,29,30,31,32,33,34,35,36,37,38,39,40,41,42,43,44,45,46,47,48,49,50,51,52,53,54,55,56,57,58,59_nodelay.client.processed	2009-05-04 18:20:36.000000000 -0500
@@ -21,4 +21,4 @@
 0.0 IP client > server: . ack 27513 win 30317 <nop,nop,timestamp 0 0>
 0.0 IP client > server: . ack 28961 win 30227 <nop,nop,timestamp 0 0>
 0.0 IP client > server: . ack 30409 win 30136 <nop,nop,timestamp 0 0>
-89.95 IP client > server: F 1:1(0) ack 30409 win 32037 <nop,nop,timestamp 0 0>
+89.94 IP client > server: F 1:1(0) ack 30409 win 32037 <nop,nop,timestamp 0 0>
Differences found in /0_24,25,26,27,28,29,30,31,32,33,34,35,36,37,38,39,40,41,42,43,44,45,46,47,48,49,50,51,52,53,54,55,56,57,58,59_nodelay
--- results.05_03_2009/freebsd7_20071205/1//0_24,25,26,27,28,29,30,31,32,33,34,35,36,37,38,39,40,41,42,43,44,45,46,47,48,49,50,51,52,53,54,55,56,57,58,59_nodelay.server.processed	2009-05-04 18:19:05.000000000 -0500
+++ results.05_03_2009/freebsd7_20071203/1//0_24,25,26,27,28,29,30,31,32,33,34,35,36,37,38,39,40,41,42,43,44,45,46,47,48,49,50,51,52,53,54,55,56,57,58,59_nodelay.server.processed	2009-05-04 18:20:36.000000000 -0500
@@ -1,4 +1,4 @@
-0.0 IP server > client: S 0:0(0) ack 0 win 65535 <mss 1460,nop,wscale 4,sackOK,timestamp 0 0>
+0.0 IP server > client: S 0:0(0) ack 0 win 65535 <mss 1460,nop,wscale 4,nop,nop,timestamp 0 0>
 0.0 IP server > client: . ack 1 win 32037 <nop,nop,timestamp 0 0>
 0.0 IP server > client: . 1:1449(1448) ack 1 win 32037 <nop,nop,timestamp 0 0>
 0.0 IP server > client: . 1449:2897(1448) ack 1 win 32037 <nop,nop,timestamp 0 0>
@@ -45,10 +45,10 @@
 0.0 IP server > client: . 60817:62265(1448) ack 1 win 32037 <nop,nop,timestamp 0 0> dropped
 0.0 IP server > client: . 62265:63713(1448) ack 1 win 32037 <nop,nop,timestamp 0 0> dropped
 0.22 IP server > client: . 30409:31857(1448) ack 1 win 32037 <nop,nop,timestamp 0 0> dropped
-0.26 IP server > client: . 30409:31857(1448) ack 1 win 32037 <nop,nop,timestamp 0 0> dropped
+0.25 IP server > client: . 30409:31857(1448) ack 1 win 32037 <nop,nop,timestamp 0 0> dropped
 0.32 IP server > client: . 30409:31857(1448) ack 1 win 32037 <nop,nop,timestamp 0 0> dropped
 0.43 IP server > client: . 30409:31857(1448) ack 1 win 32037 <nop,nop,timestamp 0 0> dropped
-0.68 IP server > client: . 30409:31857(1448) ack 1 win 32037 <nop,nop,timestamp 0 0> dropped
+0.67 IP server > client: . 30409:31857(1448) ack 1 win 32037 <nop,nop,timestamp 0 0> dropped
 1.15 IP server > client: . 30409:31857(1448) ack 1 win 32037 <nop,nop,timestamp 0 0> dropped
 2.11 IP server > client: . 30409:31857(1448) ack 1 win 32037 <nop,nop,timestamp 0 0> dropped
 4.03 IP server > client: . 30409:31857(1448) ack 1 win 32037 <nop,nop,timestamp 0 0> dropped
@@ -57,4 +57,4 @@
 15.55 IP server > client: . 30409:31857(1448) ack 1 win 32037 <nop,nop,timestamp 0 0> dropped
 15.55 IP server > client: . 30409:31857(1448) ack 1 win 32037 <nop,nop,timestamp 0 0> dropped
 15.55 IP server > client: R 63713:63713(0) ack 1 win 32037 <nop,nop,timestamp 0 0> dropped
-0.0 IP server > client: R 2992086959:2992086959(0) win 0
+0.0 IP server > client: R 497359925:497359925(0) win 0
Differences found in /0_24,25,26,27,28,29,30
--- results.05_03_2009/freebsd7_20071205/1//0_24,25,26,27,28,29,30.client.processed	2009-05-04 18:19:05.000000000 -0500
+++ results.05_03_2009/freebsd7_20071203/1//0_24,25,26,27,28,29,30.client.processed	2009-05-04 18:20:36.000000000 -0500
@@ -10,25 +10,26 @@
 0.0 IP client > server: . ack 23169 win 30589 <nop,nop,timestamp 0 0>
 0.0 IP client > server: . ack 26065 win 30408 <nop,nop,timestamp 0 0>
 0.0 IP client > server: . ack 28961 win 30227 <nop,nop,timestamp 0 0>
-0.0 IP client > server: . ack 30409 win 30136 <nop,nop,timestamp 0 0,nop,nop,sack 1 {40545:41993}>
-0.0 IP client > server: . ack 30409 win 30136 <nop,nop,timestamp 0 0,nop,nop,sack 1 {40545:43441}>
-0.0 IP client > server: . ack 30409 win 30136 <nop,nop,timestamp 0 0,nop,nop,sack 1 {40545:44889}>
-0.0 IP client > server: . ack 30409 win 30136 <nop,nop,timestamp 0 0,nop,nop,sack 1 {40545:46337}>
-0.0 IP client > server: . ack 30409 win 30136 <nop,nop,timestamp 0 0,nop,nop,sack 1 {40545:47785}>
-0.0 IP client > server: . ack 30409 win 30136 <nop,nop,timestamp 0 0,nop,nop,sack 1 {40545:49233}>
-0.0 IP client > server: . ack 30409 win 30136 <nop,nop,timestamp 0 0,nop,nop,sack 1 {40545:50681}>
-0.0 IP client > server: . ack 30409 win 30136 <nop,nop,timestamp 0 0,nop,nop,sack 1 {40545:52129}>
-0.0 IP client > server: . ack 31857 win 30046 <nop,nop,timestamp 0 0,nop,nop,sack 1 {40545:52129}>
-0.0 IP client > server: . ack 33305 win 29955 <nop,nop,timestamp 0 0,nop,nop,sack 1 {40545:52129}>
-0.0 IP client > server: . ack 34753 win 29865 <nop,nop,timestamp 0 0,nop,nop,sack 1 {40545:52129}>
-0.0 IP client > server: . ack 36201 win 29774 <nop,nop,timestamp 0 0,nop,nop,sack 1 {40545:52129}>
-0.0 IP client > server: . ack 37649 win 29684 <nop,nop,timestamp 0 0,nop,nop,sack 1 {40545:52129}>
-0.0 IP client > server: . ack 39097 win 29593 <nop,nop,timestamp 0 0,nop,nop,sack 1 {40545:52129}>
-0.0 IP client > server: . ack 52129 win 28779 <nop,nop,timestamp 0 0>
-0.0 IP client > server: . ack 55025 win 28598 <nop,nop,timestamp 0 0>
-0.0 IP client > server: . ack 57921 win 28417 <nop,nop,timestamp 0 0>
-0.0 IP client > server: . ack 60817 win 28236 <nop,nop,timestamp 0 0>
-0.0 IP client > server: . ack 63713 win 28055 <nop,nop,timestamp 0 0>
+0.0 IP client > server: . ack 30409 win 30136 <nop,nop,timestamp 0 0>
+0.0 IP client > server: . ack 30409 win 30136 <nop,nop,timestamp 0 0>
+0.0 IP client > server: . ack 30409 win 30136 <nop,nop,timestamp 0 0>
+0.0 IP client > server: . ack 30409 win 30136 <nop,nop,timestamp 0 0>
+0.0 IP client > server: . ack 30409 win 30136 <nop,nop,timestamp 0 0>
+0.0 IP client > server: . ack 30409 win 30136 <nop,nop,timestamp 0 0>
+0.0 IP client > server: . ack 30409 win 30136 <nop,nop,timestamp 0 0>
+0.0 IP client > server: . ack 30409 win 30136 <nop,nop,timestamp 0 0>
+0.0 IP client > server: . ack 31857 win 30046 <nop,nop,timestamp 0 0>
+0.0 IP client > server: . ack 33305 win 29955 <nop,nop,timestamp 0 0>
+0.0 IP client > server: . ack 34753 win 29865 <nop,nop,timestamp 0 0>
+0.0 IP client > server: . ack 36201 win 29774 <nop,nop,timestamp 0 0>
+0.0 IP client > server: . ack 37649 win 29684 <nop,nop,timestamp 0 0>
+0.0 IP client > server: . ack 39097 win 29593 <nop,nop,timestamp 0 0>
+0.0 IP client > server: . ack 39097 win 29593 <nop,nop,timestamp 0 0>
+0.0 IP client > server: . ack 53577 win 28688 <nop,nop,timestamp 0 0>
+0.0 IP client > server: . ack 56473 win 28507 <nop,nop,timestamp 0 0>
+0.0 IP client > server: . ack 59369 win 28326 <nop,nop,timestamp 0 0>
+0.0 IP client > server: . ack 62265 win 28145 <nop,nop,timestamp 0 0>
+0.0 IP client > server: . ack 65161 win 27964 <nop,nop,timestamp 0 0>
 0.0 IP client > server: . ack 65538 win 27941 <nop,nop,timestamp 0 0>
 0.0 IP client > server: . ack 65538 win 32037 <nop,nop,timestamp 0 0>
 1.0 IP client > server: F 1:1(0) ack 65538 win 32037 <nop,nop,timestamp 0 0>
Differences found in /0_24,25,26,27,28,29,30
--- results.05_03_2009/freebsd7_20071205/1//0_24,25,26,27,28,29,30.server.processed	2009-05-04 18:19:05.000000000 -0500
+++ results.05_03_2009/freebsd7_20071203/1//0_24,25,26,27,28,29,30.server.processed	2009-05-04 18:20:36.000000000 -0500
@@ -1,4 +1,4 @@
-0.0 IP server > client: S 0:0(0) ack 0 win 65535 <mss 1460,nop,wscale 4,sackOK,timestamp 0 0>
+0.0 IP server > client: S 0:0(0) ack 0 win 65535 <mss 1460,nop,wscale 4,nop,nop,timestamp 0 0>
 0.0 IP server > client: . ack 1 win 32037 <nop,nop,timestamp 0 0>
 0.0 IP server > client: . 1:1449(1448) ack 1 win 32037 <nop,nop,timestamp 0 0>
 0.0 IP server > client: . 1449:2897(1448) ack 1 win 32037 <nop,nop,timestamp 0 0>
@@ -42,8 +42,8 @@
 0.0 IP server > client: . 34753:36201(1448) ack 1 win 32037 <nop,nop,timestamp 0 0>
 0.0 IP server > client: . 36201:37649(1448) ack 1 win 32037 <nop,nop,timestamp 0 0>
 0.0 IP server > client: . 37649:39097(1448) ack 1 win 32037 <nop,nop,timestamp 0 0>
-0.0 IP server > client: . 39097:40545(1448) ack 1 win 32037 <nop,nop,timestamp 0 0>
 0.0 IP server > client: . 52129:53577(1448) ack 1 win 32037 <nop,nop,timestamp 0 0>
+0.0 IP server > client: . 39097:40545(1448) ack 1 win 32037 <nop,nop,timestamp 0 0>
 0.0 IP server > client: . 53577:55025(1448) ack 1 win 32037 <nop,nop,timestamp 0 0>
 0.0 IP server > client: . 55025:56473(1448) ack 1 win 32037 <nop,nop,timestamp 0 0>
 0.0 IP server > client: . 56473:57921(1448) ack 1 win 32037 <nop,nop,timestamp 0 0>
Differences found in /0_24,25,26,27,28,29,30_nodelay
--- results.05_03_2009/freebsd7_20071205/1//0_24,25,26,27,28,29,30_nodelay.client.processed	2009-05-04 18:19:05.000000000 -0500
+++ results.05_03_2009/freebsd7_20071203/1//0_24,25,26,27,28,29,30_nodelay.client.processed	2009-05-04 18:20:36.000000000 -0500
@@ -21,36 +21,30 @@
 0.0 IP client > server: . ack 27513 win 30317 <nop,nop,timestamp 0 0>
 0.0 IP client > server: . ack 28961 win 30227 <nop,nop,timestamp 0 0>
 0.0 IP client > server: . ack 30409 win 30136 <nop,nop,timestamp 0 0>
-0.0 IP client > server: . ack 30409 win 30136 <nop,nop,timestamp 0 0,nop,nop,sack 1 {40545:41993}>
-0.0 IP client > server: . ack 30409 win 30136 <nop,nop,timestamp 0 0,nop,nop,sack 1 {40545:43441}>
-0.0 IP client > server: . ack 30409 win 30136 <nop,nop,timestamp 0 0,nop,nop,sack 1 {40545:44889}>
-0.0 IP client > server: . ack 30409 win 30136 <nop,nop,timestamp 0 0,nop,nop,sack 1 {40545:46337}>
-0.0 IP client > server: . ack 30409 win 30136 <nop,nop,timestamp 0 0,nop,nop,sack 1 {40545:47785}>
-0.0 IP client > server: . ack 30409 win 30136 <nop,nop,timestamp 0 0,nop,nop,sack 1 {40545:49233}>
-0.0 IP client > server: . ack 30409 win 30136 <nop,nop,timestamp 0 0,nop,nop,sack 1 {40545:50681}>
-0.0 IP client > server: . ack 30409 win 30136 <nop,nop,timestamp 0 0,nop,nop,sack 1 {40545:52129}>
-0.0 IP client > server: . ack 30409 win 30136 <nop,nop,timestamp 0 0,nop,nop,sack 1 {40545:53577}>
-0.0 IP client > server: . ack 30409 win 30136 <nop,nop,timestamp 0 0,nop,nop,sack 1 {40545:55025}>
-0.0 IP client > server: . ack 30409 win 30136 <nop,nop,timestamp 0 0,nop,nop,sack 1 {40545:56473}>
-0.0 IP client > server: . ack 30409 win 30136 <nop,nop,timestamp 0 0,nop,nop,sack 1 {40545:57921}>
-0.0 IP client > server: . ack 30409 win 30136 <nop,nop,timestamp 0 0,nop,nop,sack 1 {40545:59369}>
-0.0 IP client > server: . ack 30409 win 30136 <nop,nop,timestamp 0 0,nop,nop,sack 1 {40545:60817}>
-0.0 IP client > server: . ack 30409 win 30136 <nop,nop,timestamp 0 0,nop,nop,sack 1 {40545:62265}>
-0.0 IP client > server: . ack 30409 win 30136 <nop,nop,timestamp 0 0,nop,nop,sack 1 {40545:63713}>
-0.0 IP client > server: . ack 30409 win 30136 <nop,nop,timestamp 0 0,nop,nop,sack 1 {40545:65161}>
-0.0 IP client > server: . ack 30409 win 30136 <nop,nop,timestamp 0 0,nop,nop,sack 1 {40545:65537}>
-0.0 IP client > server: . ack 31857 win 30046 <nop,nop,timestamp 0 0,nop,nop,sack 1 {40545:65537}>
-0.0 IP client > server: . ack 33305 win 29955 <nop,nop,timestamp 0 0,nop,nop,sack 1 {40545:65537}>
-0.0 IP client > server: . ack 34753 win 29865 <nop,nop,timestamp 0 0,nop,nop,sack 1 {40545:65537}>
-0.0 IP client > server: . ack 36201 win 29774 <nop,nop,timestamp 0 0,nop,nop,sack 1 {40545:65537}>
-0.0 IP client > server: . ack 37649 win 29684 <nop,nop,timestamp 0 0,nop,nop,sack 1 {40545:65537}>
-0.0 IP client > server: . ack 39097 win 29593 <nop,nop,timestamp 0 0,nop,nop,sack 1 {40545:65537}>
-0.0 IP client > server: . ack 65538 win 27941 <nop,nop,timestamp 0 0>
-0.0 IP client > server: . ack 65538 win 27941 <nop,nop,timestamp 0 0>
+0.0 IP client > server: . ack 30409 win 30136 <nop,nop,timestamp 0 0>
+0.0 IP client > server: . ack 30409 win 30136 <nop,nop,timestamp 0 0>
+0.0 IP client > server: . ack 30409 win 30136 <nop,nop,timestamp 0 0>
+0.0 IP client > server: . ack 30409 win 30136 <nop,nop,timestamp 0 0>
+0.0 IP client > server: . ack 30409 win 30136 <nop,nop,timestamp 0 0>
+0.0 IP client > server: . ack 30409 win 30136 <nop,nop,timestamp 0 0>
+0.0 IP client > server: . ack 30409 win 30136 <nop,nop,timestamp 0 0>
+0.0 IP client > server: . ack 30409 win 30136 <nop,nop,timestamp 0 0>
+0.0 IP client > server: . ack 30409 win 30136 <nop,nop,timestamp 0 0>
+0.0 IP client > server: . ack 30409 win 30136 <nop,nop,timestamp 0 0>
+0.0 IP client > server: . ack 30409 win 30136 <nop,nop,timestamp 0 0>
+0.0 IP client > server: . ack 30409 win 30136 <nop,nop,timestamp 0 0>
+0.0 IP client > server: . ack 30409 win 30136 <nop,nop,timestamp 0 0>
+0.0 IP client > server: . ack 30409 win 30136 <nop,nop,timestamp 0 0>
+0.0 IP client > server: . ack 30409 win 30136 <nop,nop,timestamp 0 0>
+0.0 IP client > server: . ack 30409 win 30136 <nop,nop,timestamp 0 0>
+0.0 IP client > server: . ack 30409 win 30136 <nop,nop,timestamp 0 0>
+0.0 IP client > server: . ack 30409 win 30136 <nop,nop,timestamp 0 0>
+0.0 IP client > server: . ack 31857 win 30046 <nop,nop,timestamp 0 0>
+0.0 IP client > server: . ack 33305 win 29955 <nop,nop,timestamp 0 0>
+0.0 IP client > server: . ack 34753 win 29865 <nop,nop,timestamp 0 0>
+0.0 IP client > server: . ack 36201 win 29774 <nop,nop,timestamp 0 0>
+0.0 IP client > server: . ack 37649 win 29684 <nop,nop,timestamp 0 0>
+0.0 IP client > server: . ack 39097 win 29593 <nop,nop,timestamp 0 0>
 0.0 IP client > server: . ack 65538 win 27941 <nop,nop,timestamp 0 0>
-0.0 IP client > server: . ack 65538 win 28122 <nop,nop,timestamp 0 0>
-0.0 IP client > server: . ack 65538 win 28122 <nop,nop,timestamp 0 0>
-0.0 IP client > server: . ack 65538 win 28122 <nop,nop,timestamp 0 0>
-0.0 IP client > server: . ack 65538 win 28122 <nop,nop,timestamp 0 0>
 0.0 IP client > server: . ack 65538 win 32037 <nop,nop,timestamp 0 0>
 1.0 IP client > server: F 1:1(0) ack 65538 win 32037 <nop,nop,timestamp 0 0>
Differences found in /0_24,25,26,27,28,29,30_nodelay
--- results.05_03_2009/freebsd7_20071205/1//0_24,25,26,27,28,29,30_nodelay.server.processed	2009-05-04 18:19:05.000000000 -0500
+++ results.05_03_2009/freebsd7_20071203/1//0_24,25,26,27,28,29,30_nodelay.server.processed	2009-05-04 18:20:36.000000000 -0500
@@ -1,4 +1,4 @@
-0.0 IP server > client: S 0:0(0) ack 0 win 65535 <mss 1460,nop,wscale 4,sackOK,timestamp 0 0>
+0.0 IP server > client: S 0:0(0) ack 0 win 65535 <mss 1460,nop,wscale 4,nop,nop,timestamp 0 0>
 0.0 IP server > client: . ack 1 win 32037 <nop,nop,timestamp 0 0>
 0.0 IP server > client: . 1:1449(1448) ack 1 win 32037 <nop,nop,timestamp 0 0>
 0.0 IP server > client: . 1449:2897(1448) ack 1 win 32037 <nop,nop,timestamp 0 0>
@@ -53,10 +53,4 @@
 0.0 IP server > client: . 36201:37649(1448) ack 1 win 32037 <nop,nop,timestamp 0 0>
 0.0 IP server > client: . 37649:39097(1448) ack 1 win 32037 <nop,nop,timestamp 0 0>
 0.0 IP server > client: . 39097:40545(1448) ack 1 win 32037 <nop,nop,timestamp 0 0>
-0.0 IP server > client: F 65537:65537(0) ack 1 win 32037 <nop,nop,timestamp 0 0>
-0.0 IP server > client: F 65537:65537(0) ack 1 win 32037 <nop,nop,timestamp 0 0>
-0.0 IP server > client: F 65537:65537(0) ack 1 win 32037 <nop,nop,timestamp 0 0>
-0.0 IP server > client: F 65537:65537(0) ack 1 win 32037 <nop,nop,timestamp 0 0>
-0.0 IP server > client: F 65537:65537(0) ack 1 win 32037 <nop,nop,timestamp 0 0>
-0.0 IP server > client: F 65537:65537(0) ack 1 win 32037 <nop,nop,timestamp 0 0>
 0.0 IP server > client: . ack 2 win 32036 <nop,nop,timestamp 0 0>
Differences found in /0_24,25,26,27,28,29
--- results.05_03_2009/freebsd7_20071205/1//0_24,25,26,27,28,29.client.processed	2009-05-04 18:19:05.000000000 -0500
+++ results.05_03_2009/freebsd7_20071203/1//0_24,25,26,27,28,29.client.processed	2009-05-04 18:20:36.000000000 -0500
@@ -10,25 +10,26 @@
 0.0 IP client > server: . ack 23169 win 30589 <nop,nop,timestamp 0 0>
 0.0 IP client > server: . ack 26065 win 30408 <nop,nop,timestamp 0 0>
 0.0 IP client > server: . ack 28961 win 30227 <nop,nop,timestamp 0 0>
-0.0 IP client > server: . ack 30409 win 30136 <nop,nop,timestamp 0 0,nop,nop,sack 1 {39097:40545}>
-0.0 IP client > server: . ack 30409 win 30136 <nop,nop,timestamp 0 0,nop,nop,sack 1 {39097:41993}>
-0.0 IP client > server: . ack 30409 win 30136 <nop,nop,timestamp 0 0,nop,nop,sack 1 {39097:43441}>
-0.0 IP client > server: . ack 30409 win 30136 <nop,nop,timestamp 0 0,nop,nop,sack 1 {39097:44889}>
-0.0 IP client > server: . ack 30409 win 30136 <nop,nop,timestamp 0 0,nop,nop,sack 1 {39097:46337}>
-0.0 IP client > server: . ack 30409 win 30136 <nop,nop,timestamp 0 0,nop,nop,sack 1 {39097:47785}>
-0.0 IP client > server: . ack 30409 win 30136 <nop,nop,timestamp 0 0,nop,nop,sack 1 {39097:49233}>
-0.0 IP client > server: . ack 30409 win 30136 <nop,nop,timestamp 0 0,nop,nop,sack 1 {39097:50681}>
-0.0 IP client > server: . ack 30409 win 30136 <nop,nop,timestamp 0 0,nop,nop,sack 1 {39097:52129}>
-0.0 IP client > server: . ack 31857 win 30046 <nop,nop,timestamp 0 0,nop,nop,sack 1 {39097:52129}>
-0.0 IP client > server: . ack 33305 win 29955 <nop,nop,timestamp 0 0,nop,nop,sack 1 {39097:52129}>
-0.0 IP client > server: . ack 34753 win 29865 <nop,nop,timestamp 0 0,nop,nop,sack 1 {39097:52129}>
-0.0 IP client > server: . ack 36201 win 29774 <nop,nop,timestamp 0 0,nop,nop,sack 1 {39097:52129}>
-0.0 IP client > server: . ack 37649 win 29684 <nop,nop,timestamp 0 0,nop,nop,sack 1 {39097:52129}>
-0.0 IP client > server: . ack 52129 win 28779 <nop,nop,timestamp 0 0>
-0.0 IP client > server: . ack 55025 win 28598 <nop,nop,timestamp 0 0>
-0.0 IP client > server: . ack 57921 win 28417 <nop,nop,timestamp 0 0>
-0.0 IP client > server: . ack 60817 win 28236 <nop,nop,timestamp 0 0>
-0.0 IP client > server: . ack 63713 win 28055 <nop,nop,timestamp 0 0>
+0.0 IP client > server: . ack 30409 win 30136 <nop,nop,timestamp 0 0>
+0.0 IP client > server: . ack 30409 win 30136 <nop,nop,timestamp 0 0>
+0.0 IP client > server: . ack 30409 win 30136 <nop,nop,timestamp 0 0>
+0.0 IP client > server: . ack 30409 win 30136 <nop,nop,timestamp 0 0>
+0.0 IP client > server: . ack 30409 win 30136 <nop,nop,timestamp 0 0>
+0.0 IP client > server: . ack 30409 win 30136 <nop,nop,timestamp 0 0>
+0.0 IP client > server: . ack 30409 win 30136 <nop,nop,timestamp 0 0>
+0.0 IP client > server: . ack 30409 win 30136 <nop,nop,timestamp 0 0>
+0.0 IP client > server: . ack 30409 win 30136 <nop,nop,timestamp 0 0>
+0.0 IP client > server: . ack 31857 win 30046 <nop,nop,timestamp 0 0>
+0.0 IP client > server: . ack 33305 win 29955 <nop,nop,timestamp 0 0>
+0.0 IP client > server: . ack 34753 win 29865 <nop,nop,timestamp 0 0>
+0.0 IP client > server: . ack 36201 win 29774 <nop,nop,timestamp 0 0>
+0.0 IP client > server: . ack 37649 win 29684 <nop,nop,timestamp 0 0>
+0.0 IP client > server: . ack 37649 win 29684 <nop,nop,timestamp 0 0>
+0.0 IP client > server: . ack 53577 win 28688 <nop,nop,timestamp 0 0>
+0.0 IP client > server: . ack 56473 win 28507 <nop,nop,timestamp 0 0>
+0.0 IP client > server: . ack 59369 win 28326 <nop,nop,timestamp 0 0>
+0.0 IP client > server: . ack 62265 win 28145 <nop,nop,timestamp 0 0>
+0.0 IP client > server: . ack 65161 win 27964 <nop,nop,timestamp 0 0>
 0.0 IP client > server: . ack 65538 win 27941 <nop,nop,timestamp 0 0>
 0.0 IP client > server: . ack 65538 win 32037 <nop,nop,timestamp 0 0>
 1.0 IP client > server: F 1:1(0) ack 65538 win 32037 <nop,nop,timestamp 0 0>
Differences found in /0_24,25,26,27,28,29
--- results.05_03_2009/freebsd7_20071205/1//0_24,25,26,27,28,29.server.processed	2009-05-04 18:19:05.000000000 -0500
+++ results.05_03_2009/freebsd7_20071203/1//0_24,25,26,27,28,29.server.processed	2009-05-04 18:20:36.000000000 -0500
@@ -1,4 +1,4 @@
-0.0 IP server > client: S 0:0(0) ack 0 win 65535 <mss 1460,nop,wscale 4,sackOK,timestamp 0 0>
+0.0 IP server > client: S 0:0(0) ack 0 win 65535 <mss 1460,nop,wscale 4,nop,nop,timestamp 0 0>
 0.0 IP server > client: . ack 1 win 32037 <nop,nop,timestamp 0 0>
 0.0 IP server > client: . 1:1449(1448) ack 1 win 32037 <nop,nop,timestamp 0 0>
 0.0 IP server > client: . 1449:2897(1448) ack 1 win 32037 <nop,nop,timestamp 0 0>
@@ -41,8 +41,8 @@
 0.0 IP server > client: . 33305:34753(1448) ack 1 win 32037 <nop,nop,timestamp 0 0>
 0.0 IP server > client: . 34753:36201(1448) ack 1 win 32037 <nop,nop,timestamp 0 0>
 0.0 IP server > client: . 36201:37649(1448) ack 1 win 32037 <nop,nop,timestamp 0 0>
-0.0 IP server > client: . 37649:39097(1448) ack 1 win 32037 <nop,nop,timestamp 0 0>
 0.0 IP server > client: . 52129:53577(1448) ack 1 win 32037 <nop,nop,timestamp 0 0>
+0.0 IP server > client: . 37649:39097(1448) ack 1 win 32037 <nop,nop,timestamp 0 0>
 0.0 IP server > client: . 53577:55025(1448) ack 1 win 32037 <nop,nop,timestamp 0 0>
 0.0 IP server > client: . 55025:56473(1448) ack 1 win 32037 <nop,nop,timestamp 0 0>
 0.0 IP server > client: . 56473:57921(1448) ack 1 win 32037 <nop,nop,timestamp 0 0>
Differences found in /0_24,25,26,27,28,29_nodelay
--- results.05_03_2009/freebsd7_20071205/1//0_24,25,26,27,28,29_nodelay.client.processed	2009-05-04 18:19:05.000000000 -0500
+++ results.05_03_2009/freebsd7_20071203/1//0_24,25,26,27,28,29_nodelay.client.processed	2009-05-04 18:20:36.000000000 -0500
@@ -21,35 +21,30 @@
 0.0 IP client > server: . ack 27513 win 30317 <nop,nop,timestamp 0 0>
 0.0 IP client > server: . ack 28961 win 30227 <nop,nop,timestamp 0 0>
 0.0 IP client > server: . ack 30409 win 30136 <nop,nop,timestamp 0 0>
-0.0 IP client > server: . ack 30409 win 30136 <nop,nop,timestamp 0 0,nop,nop,sack 1 {39097:40545}>
-0.0 IP client > server: . ack 30409 win 30136 <nop,nop,timestamp 0 0,nop,nop,sack 1 {39097:41993}>
-0.0 IP client > server: . ack 30409 win 30136 <nop,nop,timestamp 0 0,nop,nop,sack 1 {39097:43441}>
-0.0 IP client > server: . ack 30409 win 30136 <nop,nop,timestamp 0 0,nop,nop,sack 1 {39097:44889}>
-0.0 IP client > server: . ack 30409 win 30136 <nop,nop,timestamp 0 0,nop,nop,sack 1 {39097:46337}>
-0.0 IP client > server: . ack 30409 win 30136 <nop,nop,timestamp 0 0,nop,nop,sack 1 {39097:47785}>
-0.0 IP client > server: . ack 30409 win 30136 <nop,nop,timestamp 0 0,nop,nop,sack 1 {39097:49233}>
-0.0 IP client > server: . ack 30409 win 30136 <nop,nop,timestamp 0 0,nop,nop,sack 1 {39097:50681}>
-0.0 IP client > server: . ack 30409 win 30136 <nop,nop,timestamp 0 0,nop,nop,sack 1 {39097:52129}>
-0.0 IP client > server: . ack 30409 win 30136 <nop,nop,timestamp 0 0,nop,nop,sack 1 {39097:53577}>
-0.0 IP client > server: . ack 30409 win 30136 <nop,nop,timestamp 0 0,nop,nop,sack 1 {39097:55025}>
-0.0 IP client > server: . ack 30409 win 30136 <nop,nop,timestamp 0 0,nop,nop,sack 1 {39097:56473}>
-0.0 IP client > server: . ack 30409 win 30136 <nop,nop,timestamp 0 0,nop,nop,sack 1 {39097:57921}>
-0.0 IP client > server: . ack 30409 win 30136 <nop,nop,timestamp 0 0,nop,nop,sack 1 {39097:59369}>
-0.0 IP client > server: . ack 30409 win 30136 <nop,nop,timestamp 0 0,nop,nop,sack 1 {39097:60817}>
-0.0 IP client > server: . ack 30409 win 30136 <nop,nop,timestamp 0 0,nop,nop,sack 1 {39097:62265}>
-0.0 IP client > server: . ack 30409 win 30136 <nop,nop,timestamp 0 0,nop,nop,sack 1 {39097:63713}>
-0.0 IP client > server: . ack 30409 win 30136 <nop,nop,timestamp 0 0,nop,nop,sack 1 {39097:65161}>
-0.0 IP client > server: . ack 30409 win 30136 <nop,nop,timestamp 0 0,nop,nop,sack 1 {39097:65537}>
-0.0 IP client > server: . ack 31857 win 30046 <nop,nop,timestamp 0 0,nop,nop,sack 1 {39097:65537}>
-0.0 IP client > server: . ack 33305 win 29955 <nop,nop,timestamp 0 0,nop,nop,sack 1 {39097:65537}>
-0.0 IP client > server: . ack 34753 win 29865 <nop,nop,timestamp 0 0,nop,nop,sack 1 {39097:65537}>
-0.0 IP client > server: . ack 36201 win 29774 <nop,nop,timestamp 0 0,nop,nop,sack 1 {39097:65537}>
-0.0 IP client > server: . ack 37649 win 29684 <nop,nop,timestamp 0 0,nop,nop,sack 1 {39097:65537}>
+0.0 IP client > server: . ack 30409 win 30136 <nop,nop,timestamp 0 0>
+0.0 IP client > server: . ack 30409 win 30136 <nop,nop,timestamp 0 0>
+0.0 IP client > server: . ack 30409 win 30136 <nop,nop,timestamp 0 0>
+0.0 IP client > server: . ack 30409 win 30136 <nop,nop,timestamp 0 0>
+0.0 IP client > server: . ack 30409 win 30136 <nop,nop,timestamp 0 0>
+0.0 IP client > server: . ack 30409 win 30136 <nop,nop,timestamp 0 0>
+0.0 IP client > server: . ack 30409 win 30136 <nop,nop,timestamp 0 0>
+0.0 IP client > server: . ack 30409 win 30136 <nop,nop,timestamp 0 0>
+0.0 IP client > server: . ack 30409 win 30136 <nop,nop,timestamp 0 0>
+0.0 IP client > server: . ack 30409 win 30136 <nop,nop,timestamp 0 0>
+0.0 IP client > server: . ack 30409 win 30136 <nop,nop,timestamp 0 0>
+0.0 IP client > server: . ack 30409 win 30136 <nop,nop,timestamp 0 0>
+0.0 IP client > server: . ack 30409 win 30136 <nop,nop,timestamp 0 0>
+0.0 IP client > server: . ack 30409 win 30136 <nop,nop,timestamp 0 0>
+0.0 IP client > server: . ack 30409 win 30136 <nop,nop,timestamp 0 0>
+0.0 IP client > server: . ack 30409 win 30136 <nop,nop,timestamp 0 0>
+0.0 IP client > server: . ack 30409 win 30136 <nop,nop,timestamp 0 0>
+0.0 IP client > server: . ack 30409 win 30136 <nop,nop,timestamp 0 0>
+0.0 IP client > server: . ack 30409 win 30136 <nop,nop,timestamp 0 0>
+0.0 IP client > server: . ack 31857 win 30046 <nop,nop,timestamp 0 0>
+0.0 IP client > server: . ack 33305 win 29955 <nop,nop,timestamp 0 0>
+0.0 IP client > server: . ack 34753 win 29865 <nop,nop,timestamp 0 0>
+0.0 IP client > server: . ack 36201 win 29774 <nop,nop,timestamp 0 0>
+0.0 IP client > server: . ack 37649 win 29684 <nop,nop,timestamp 0 0>
 0.0 IP client > server: . ack 65538 win 27941 <nop,nop,timestamp 0 0>
-0.0 IP client > server: . ack 65538 win 28122 <nop,nop,timestamp 0 0>
-0.0 IP client > server: . ack 65538 win 28936 <nop,nop,timestamp 0 0>
-0.0 IP client > server: . ack 65538 win 28936 <nop,nop,timestamp 0 0>
-0.0 IP client > server: . ack 65538 win 28936 <nop,nop,timestamp 0 0>
-0.0 IP client > server: . ack 65538 win 28936 <nop,nop,timestamp 0 0>
 0.0 IP client > server: . ack 65538 win 32037 <nop,nop,timestamp 0 0>
 1.0 IP client > server: F 1:1(0) ack 65538 win 32037 <nop,nop,timestamp 0 0>
Differences found in /0_24,25,26,27,28,29_nodelay
--- results.05_03_2009/freebsd7_20071205/1//0_24,25,26,27,28,29_nodelay.server.processed	2009-05-04 18:19:05.000000000 -0500
+++ results.05_03_2009/freebsd7_20071203/1//0_24,25,26,27,28,29_nodelay.server.processed	2009-05-04 18:20:36.000000000 -0500
@@ -1,4 +1,4 @@
-0.0 IP server > client: S 0:0(0) ack 0 win 65535 <mss 1460,nop,wscale 4,sackOK,timestamp 0 0>
+0.0 IP server > client: S 0:0(0) ack 0 win 65535 <mss 1460,nop,wscale 4,nop,nop,timestamp 0 0>
 0.0 IP server > client: . ack 1 win 32037 <nop,nop,timestamp 0 0>
 0.0 IP server > client: . 1:1449(1448) ack 1 win 32037 <nop,nop,timestamp 0 0>
 0.0 IP server > client: . 1449:2897(1448) ack 1 win 32037 <nop,nop,timestamp 0 0>
@@ -52,9 +52,4 @@
 0.0 IP server > client: . 34753:36201(1448) ack 1 win 32037 <nop,nop,timestamp 0 0>
 0.0 IP server > client: . 36201:37649(1448) ack 1 win 32037 <nop,nop,timestamp 0 0>
 0.0 IP server > client: . 37649:39097(1448) ack 1 win 32037 <nop,nop,timestamp 0 0>
-0.0 IP server > client: F 65537:65537(0) ack 1 win 32037 <nop,nop,timestamp 0 0>
-0.0 IP server > client: F 65537:65537(0) ack 1 win 32037 <nop,nop,timestamp 0 0>
-0.0 IP server > client: F 65537:65537(0) ack 1 win 32037 <nop,nop,timestamp 0 0>
-0.0 IP server > client: F 65537:65537(0) ack 1 win 32037 <nop,nop,timestamp 0 0>
-0.0 IP server > client: F 65537:65537(0) ack 1 win 32037 <nop,nop,timestamp 0 0>
 0.0 IP server > client: . ack 2 win 32036 <nop,nop,timestamp 0 0>
Differences found in /0_24,25,26,27,28
--- results.05_03_2009/freebsd7_20071205/1//0_24,25,26,27,28.client.processed	2009-05-04 18:19:05.000000000 -0500
+++ results.05_03_2009/freebsd7_20071203/1//0_24,25,26,27,28.client.processed	2009-05-04 18:20:36.000000000 -0500
@@ -10,25 +10,26 @@
 0.0 IP client > server: . ack 23169 win 30589 <nop,nop,timestamp 0 0>
 0.0 IP client > server: . ack 26065 win 30408 <nop,nop,timestamp 0 0>
 0.0 IP client > server: . ack 28961 win 30227 <nop,nop,timestamp 0 0>
-0.0 IP client > server: . ack 30409 win 30136 <nop,nop,timestamp 0 0,nop,nop,sack 1 {37649:39097}>
-0.0 IP client > server: . ack 30409 win 30136 <nop,nop,timestamp 0 0,nop,nop,sack 1 {37649:40545}>
-0.0 IP client > server: . ack 30409 win 30136 <nop,nop,timestamp 0 0,nop,nop,sack 1 {37649:41993}>
-0.0 IP client > server: . ack 30409 win 30136 <nop,nop,timestamp 0 0,nop,nop,sack 1 {37649:43441}>
-0.0 IP client > server: . ack 30409 win 30136 <nop,nop,timestamp 0 0,nop,nop,sack 1 {37649:44889}>
-0.0 IP client > server: . ack 30409 win 30136 <nop,nop,timestamp 0 0,nop,nop,sack 1 {37649:46337}>
-0.0 IP client > server: . ack 30409 win 30136 <nop,nop,timestamp 0 0,nop,nop,sack 1 {37649:47785}>
-0.0 IP client > server: . ack 30409 win 30136 <nop,nop,timestamp 0 0,nop,nop,sack 1 {37649:49233}>
-0.0 IP client > server: . ack 30409 win 30136 <nop,nop,timestamp 0 0,nop,nop,sack 1 {37649:50681}>
-0.0 IP client > server: . ack 30409 win 30136 <nop,nop,timestamp 0 0,nop,nop,sack 1 {37649:52129}>
-0.0 IP client > server: . ack 31857 win 30046 <nop,nop,timestamp 0 0,nop,nop,sack 1 {37649:52129}>
-0.0 IP client > server: . ack 33305 win 29955 <nop,nop,timestamp 0 0,nop,nop,sack 1 {37649:52129}>
-0.0 IP client > server: . ack 34753 win 29865 <nop,nop,timestamp 0 0,nop,nop,sack 1 {37649:52129}>
-0.0 IP client > server: . ack 36201 win 29774 <nop,nop,timestamp 0 0,nop,nop,sack 1 {37649:52129}>
-0.0 IP client > server: . ack 52129 win 28779 <nop,nop,timestamp 0 0>
-0.0 IP client > server: . ack 55025 win 28598 <nop,nop,timestamp 0 0>
-0.0 IP client > server: . ack 57921 win 28417 <nop,nop,timestamp 0 0>
-0.0 IP client > server: . ack 60817 win 28236 <nop,nop,timestamp 0 0>
-0.0 IP client > server: . ack 63713 win 28055 <nop,nop,timestamp 0 0>
+0.0 IP client > server: . ack 30409 win 30136 <nop,nop,timestamp 0 0>
+0.0 IP client > server: . ack 30409 win 30136 <nop,nop,timestamp 0 0>
+0.0 IP client > server: . ack 30409 win 30136 <nop,nop,timestamp 0 0>
+0.0 IP client > server: . ack 30409 win 30136 <nop,nop,timestamp 0 0>
+0.0 IP client > server: . ack 30409 win 30136 <nop,nop,timestamp 0 0>
+0.0 IP client > server: . ack 30409 win 30136 <nop,nop,timestamp 0 0>
+0.0 IP client > server: . ack 30409 win 30136 <nop,nop,timestamp 0 0>
+0.0 IP client > server: . ack 30409 win 30136 <nop,nop,timestamp 0 0>
+0.0 IP client > server: . ack 30409 win 30136 <nop,nop,timestamp 0 0>
+0.0 IP client > server: . ack 30409 win 30136 <nop,nop,timestamp 0 0>
+0.0 IP client > server: . ack 31857 win 30046 <nop,nop,timestamp 0 0>
+0.0 IP client > server: . ack 33305 win 29955 <nop,nop,timestamp 0 0>
+0.0 IP client > server: . ack 34753 win 29865 <nop,nop,timestamp 0 0>
+0.0 IP client > server: . ack 36201 win 29774 <nop,nop,timestamp 0 0>
+0.0 IP client > server: . ack 36201 win 29774 <nop,nop,timestamp 0 0>
